kml_name;kml_description;longitude;latitude;height
Иран - АЭС Бушер 2;"<img src="https://doc-04-04-mymaps.googleusercontent.com/untrusted/hostedimage/67ht0gn364521qiheeia79564g/a4pd2fgajt6cgr6hp53i0j3ou0/1595361600000/FTCPzVzQEZ0A9SJ2YuS7DeTeOtpcj_VS/*/6AF2TALroyEu403_eM3BeZcPG4PL2fy7OSgMRSZR6ZN4jWfHjzqQfuQczZ3J8st5H5m1YZXUfQaws4nOMxOT_pVphxaRG1PY76DnjN6FMe8fEpzHNTxWgBZ2Zs0x9GuiHRUmPu2YIsf5u1k6eDGuNPfFvYgm7Pvzl_HikmfgxQXyEjnD_twfJDq6GHlJNCU6n9Vwu2JXeOF9Zfh2jhkrNGWA7OEDZ_GkFlKTuAyw3T3Yt5HyUgnqNvN1J1JHy5-eMZYt318hgSPp8cGdztp9QsshWcErsA3o2gg?session=0&fife" height="200" width="auto" /><br><br>Реализация проекта АЭС «Бушер-1» позволила выйти на подписание в 2014 году Протокола к Межправсоглашению от 25.08.1992, где предусмотрена возможность строительства восьми блоков АЭС на территории Ирана.<br>Одновременно 11 ноября 2014 года был подписан контракт, по которому Атомстройэкспорт построит второй и третий энергоблоки АЭС «Бушер». 10 сентября 2016 года состоялась торжественная закладка «первого камня». Началом работ по Контракту является 28 декабря 2016 года, когда российская сторона получила аванс от иранского заказчика. <br>В течение 2017 года проводились работы по подготовке Площадки. 14 марта 2001 года на площадке АЭС «Бушер-2» были начаты работы по вертикальной планировке. 31 октября 2017 года состоялась торжественная церемония начала работ на котловане основных зданий энергоблока №2.<br><br>В 2018 году запланировано проведение инженерно-геологических изысканий морской акватории и участка под водосбросные сооружения. Планируется согласовать проект АЭС «Бушер-2» с Заказчиком и начать процедуры, связанные с экспертизой и получением лицензии на сооружение у иранского регулятора. На 2018 год запланировано обустройство котлована для энергоблока №3, а на 2019 год – «первый бетон» на энергоблоке №2. В соответствии с Контрактом, предварительная приемка Блока 2 планируется в 2026 г., Блока 3 – в 2027 г.     <br><br>Станция будет сооружаться по новому проекту поколения III+, который в 2007 году был сертифицирован в Европе и признан отвечающим всем нормам безопасности и эффективности (проект получил сертификат EUR - европейских эксплуатирующих организаций). В проекте реализованы уникальные технологии и новейшие решения, а также новая концепция безопасности.";50.898848;28.8284637;0
Испания - АЭС Альмарас;"<img src="https://doc-0s-04-mymaps.googleusercontent.com/untrusted/hostedimage/67ht0gn364521qiheeia79564g/4cqb8o6o46coh77m3i2vmg3dp8/1595361600000/FTCPzVzQEZ0A9SJ2YuS7DeTeOtpcj_VS/*/6AF2TALqFUBtirdAndkp8qrAlelILAsvmeVzixGc4L2PGvxS7v50Uwl_y-esBEyBbmPDqWepMIbtleaSQK2MipE-BycErfgMJb-TqC1RmJiBCyjQjsQmvghUdEEuVw_WUibQeciBJY3nkUHF_n4x6n_3EeH7nRqcoE1L56FTnzQ7e9_pJ-Mm5xE_DaeTlhH_cvcLvj-JpQKO0qBUQUnEbbQKousPxTjG6Nh927YpZBReSbJFFo_bccTvGGZu8vkYUxfEFGcqaHY0Wf37xJyfHlebLRNXoSIn4fA?session=0&fife" height="200" width="auto" /><br><br>действующая атомная электростанция на западе Испании в Эстремадуре.<br><br>АЭС расположена в муниципалитете Альмарас провинции Касерес в 58 км на юго-восток от города Пласенсия.<br><br>АЭС имеет в своем составе два реактора с водой под давлением (PWR) компании Westinghouse.<br><br>7 июня 2010 года лицензия на эксплуатацию энергоблоков № 1 и № 2 АЭС «Альмарас» была продлена на десять лет до 8 июня 2020 года. К 2020 году, когда истечет срок действия лицензии, блоки проработают 39 и 37 лет, соответственно. Разрешённый в Испании срок эксплуатации энергоблоков АЭС составляет 40 лет.<br><br>Выданное Советом по ядерной безопасности Испании (CSN) заключение содержит ряд условия и дополнительных мероприятий, которые должны быть выполнены в случае продления лицензии, в том числе мероприятий по модернизации различных систем АЭС. По данным CNAT, объём инвестиций на модернизацию и обеспечение безопасности АЭС «Альмарас», который был запланирован на период 2009—2010 гг., составил 60 млн евро";-5.6978953;39.8072595;0
Испания - АЭС Аско;"<img src="https://doc-10-04-mymaps.googleusercontent.com/untrusted/hostedimage/67ht0gn364521qiheeia79564g/d9egcfusteo576e3icvs3hrmmg/1595361600000/FTCPzVzQEZ0A9SJ2YuS7DeTeOtpcj_VS/*/6AF2TALocjSyvzJaZ-lnSXW5BsXNZDHjio4RLydzEIRiGvEmlaqUJl3whdbdc3cTYclzTv5rBmshDtnsBxEH7PWfaK2FXeWQIktxiAiqbVTtZSpBssESz1C3vGM86WGrz4rRd0hKERmgnklU6gudGPimFynATe03wmQ-rxnPXl6Hf8m-_MYfgx0fqdeZjGZZgiSehnWi7jxjX-iZyC7-8OFOLZPZ9Pe1Vp0tEJKWIp-YbA_xBDUYAYbHyUJaiCbhg285bDybMgQzp7X35uuFTn0lmEgqwds3Sow?session=0&fife" height="200" width="auto" /><br><br>Действующая атомная электростанция на северо-востоке Испании в Каталонии.<br><br>АЭС расположена на берегу реки Эбро в муниципалитете Аско провинции Таррагона в 60 км на юг от города Лерида.<br><br>АЭС имеет в своем составе два реактора с водой под давлением (PWR) компании Westinghouse. Тип охлаждения - открытый и смешанный цикл (река Эбро).";0.5694592;41.2006984;0
Испания - АЭС Вандельос;"<img src="https://doc-08-04-mymaps.googleusercontent.com/untrusted/hostedimage/67ht0gn364521qiheeia79564g/n5vri9c8g3ct4ebcn42se3neo8/1595361600000/FTCPzVzQEZ0A9SJ2YuS7DeTeOtpcj_VS/*/6AF2TALpyYR1fKO_nab85mXae7TrJvItVNbEDHv7dFiVMcd8W430d234o-01IsFsjVwAV-a9_7m8H1IDUDSdHmVjSJJdF2ix7mUkfunAG-WZBOznDEG2_FomXfT53x2dR07qG282KZfbUBMXduZORYRmkPtNe_PHUloD_19vkxMau5yNsd6uZM71p2iSLdeleKA_Lqp583IuZ-WyBgZzHJpwhBC2ODM1Y2Ao2HcfM-onn9G5Q_zjgRfXuL2eLthlLlC-qABeCzHZ1w1mgoV_ffZgoZVEUK5nHNA?session=0&fife" height="200" width="auto" /><br><br>Атомная электростанция, расположенная в небольшом испанском городе Вандельос (муниципалитет Вандельос-и-ла-Оспиталет-дель-Инфант), недалеко от перевала Колл де Балагер в Каталонии. Станция принадлежит компаниям Endesa (72% акций) и Iberdrola (28%).<br><br>В состав АЭС входит два энергоблока: 1-й мощностью 508 МВт (графито-газовый) и 2-й мощностью 1080 МВт (водо-водяной). Блок 1 был закрыт 31 июля 1990 года вследствие пожара, произошедшего в октябре 1989 года.";0.8656068;40.9510388;0
Испания - АЭС Кофрентес;"<img src="https://doc-10-04-mymaps.googleusercontent.com/untrusted/hostedimage/67ht0gn364521qiheeia79564g/8t6k4tvim1bje5cgi77l6plui8/1595361600000/FTCPzVzQEZ0A9SJ2YuS7DeTeOtpcj_VS/*/6AF2TALpuix9GBGxhmjVPP0ufcNW5hs4cCkbAc_N3tuIZf1WwCC5dCcA_XZAzK0wZ_Cp5zYxhxjXFdwfNbBXv110U7jrxe9bKBX-XQU8nur82bioenOe9hEnMM7Bg9tl_ZXmVF1pB1NL3_5A7cbNCm4P_j2GagPKq25KvG6zcm59TG0y-fB_5wv2mCjwMEsNmgDlYgsYHZxoPOOhZ_DatE2iun_FquS5ZDI_arFTCNELGmORBjHEJDkgxeOM5pG67mOJiRwzdD1shL9pYSwz8ylDjyi6m_Fj1QA?session=0&fife" height="200" width="auto" /><br><br>Действующая атомная электростанция на востоке Испании.<br><br>АЭС расположена на берегу реки Хукар в муниципалитете Кофрентес провинции Валенсия в 100 км на юго-запад от города Валенсия.<br><br>На АЭС Кофрентес применяется один реактор типа BWR (кипящий водяной реактор) компании General Electric мощностью 1102 МВт";-1.0504345;39.2176959;0
Испания - АЭС Санта-Мария-де-Гаронья;"<img src="https://doc-0g-04-mymaps.googleusercontent.com/untrusted/hostedimage/67ht0gn364521qiheeia79564g/025an7qbe9jcn9eroavd18d09o/1595361600000/FTCPzVzQEZ0A9SJ2YuS7DeTeOtpcj_VS/*/6AF2TALoJ4LktF1Tv3iFmGRviqTBFFwMakqgiNFeR3YCg2E2b4h94gikpMdg40CIC3l065y7sSSfBsSPPKTDZ6n4dYsg0fAvoReO6G1YZHtCQ8cKuJqxNE1j-krA4V8yJmNMc1VmU-PE2qbzHwe6Wcu5rn7CpSM9pHXtOBr2c6ph6CVlwPTNqpvayx-_tz6V2OITPOIlfZY492-rewbxQ5_nZjwHWDJgO7Uyu-2H8uCWLI5EFrhgx-FGkw8X6Ine9wcA4KfVEGiBRPJBaTFndcyV2_PFDVFGgHA?session=0&fife" height="200" width="auto" /><br><br>Атомная электростанция на севере Испании, окончательно остановлена 2 августа 2017 года.<br><br>АЭС расположена на берегу реки Эбро возле городка Санта-Мария-де-Гаронья в муниципалитете Валье-де-Тобалина провинции Бургос в 58 км на юго-запад от города Витория-Гастейс.<br><br>В состав АЭС входит один реактор типа BWR (кипящий водяной реактор) компании General Electric мощностью 466 МВт.<br><br>АЭС была открыта в 1971 году. Вывод из эксплуатации АЭС должнен был произойти 5 июля 2009 года, если бы действие лицензии по продлению срока службы не было возобновлено. Компания Nuclenor оператор АЭС добилась десятилетнего продления, которое было поддержано Советом по ядерной безопасности Испании (CSN), несмотря на политику Испании поэтапного отказа от ядерной энергетики. 2 июля 2009 года Министерство промышленности, туризма и торговли пошло на компромисс, продлив действие лицензии оператора АЭС на дополнительные четыре года";-3.207273799999999;42.7750327;0
Испания - АЭС Трильо;"<img src="https://doc-0k-04-mymaps.googleusercontent.com/untrusted/hostedimage/67ht0gn364521qiheeia79564g/r5ks6ns2iukjndr707mc2tgi1k/1595361600000/FTCPzVzQEZ0A9SJ2YuS7DeTeOtpcj_VS/*/6AF2TALqvfF0Ngo0_zxdRdNq10jGVvf3_Nt5TDXRj0yrfIhNaWqYd47uVzrYhvD19NHbdDHA8Ixsj51ta7XGo6UtKsi72XwUWp2FfrDyBUZ-d9jG6ua-kSRBlRnQIKgRxDxdOnjf_j7rc4hzCYd4lGFLSIYtF4ZASABpsul07yBscUTZhGJ1qYwIFqHoMEQUp-S45VlgHbDpMhXeOPxoyLMNs4KoSLtxgixnl7JdKCVSIBrB81DgRrXUSYCKDhuRdOgMcfdonVXmyoRvq5mTe9MOrHlMTsJbCDQ?session=0&fife" height="200" width="auto" /><br><br>Действующая атомная электростанция в центральной части Испании.<br><br>АЭС расположена в муниципалитете Трильо провинции Гвадалахара в 110 км на север-восток от Мадрида.<br><br>В состав АЭС входит один реактор с водой под давлением (PWR) компании Kraftwerk Union мощностью 1066 Мвт";-2.6233369;40.7004481;0
Испания - АЭС Хосе Кабрера;"<img src="https://doc-10-04-mymaps.googleusercontent.com/untrusted/hostedimage/67ht0gn364521qiheeia79564g/23pa8penid9orkrg11v4fve4c4/1595361600000/FTCPzVzQEZ0A9SJ2YuS7DeTeOtpcj_VS/*/6AF2TALqLHgyrpWI0lIhosiY0PGz3hItOSwSHAb9dJFmHEyx3bagzg7XusDOv_NLbLKQ-SJ0uTgNo6TLmdQwrST00T92Wla1e4SsFgwSy1fTdGDcM2VjhihypjT1glrix7JhUe9Ojuo4e4yzJmy7CZpOAZB4LqwO6AgEl4WUUJLrH2kswAv-MPVFQZgzqWE23kTxw45m6XXtMIsj42LLGnZPCMY5GphI39hMDXlYbal7NkPvuuaForldsY8Q5j-qthbiQh8Pf-4N-nv8fhAhgn9VzJPC5eqvcMQ?session=0&fife" height="200" width="auto" /><br><br>Закрытая атомная электростанция в центральной части Испании.<br><br>АЭС расположена на берегу реки Тахо в муниципалитете Альмонасид-де-Сорита провинции Гвадалахара в 80 км на восток от Мадрида. В 45 км на север от станции находится действующая АЭС Трильо.<br><br>АЭС Хосе Кабрера (Сорита) – первая АЭС Испании. Строительство станции началось в 1964 году, а 13 августа 1969 года она дала первый ток в сеть. Всего на АЭС Хосе Кабрера был построен и запущен один реактор типа PWR компании Westinghouse мощностью 160 МВт, проработавший вплоть до закрытия 30 апреля 2006 года.";-2.8854165;40.3482727;0
Италия - АЭС Гарильяно;"<img src="https://doc-0g-04-mymaps.googleusercontent.com/untrusted/hostedimage/67ht0gn364521qiheeia79564g/ih4rgho4v9ebrqil6flt78e1i4/1595361600000/FTCPzVzQEZ0A9SJ2YuS7DeTeOtpcj_VS/*/6AF2TALqwMDLn2qoJG-Slw1cZInmGvwSQa6bygjKDKiOXhy8Xg9hVCSxtLiNnZsLINQDVDsiP-MarjZYCfkTzJVBfcmZM72QcAJHoIvLirLen4XsvQGYLr5GmCTGrue-nIOFHHQ7I2dAZEEYXeIyEF7jDXui-37VsWtgQdpl7oDc6Xq6cZAkUN2ZCY2DMhKZC5-jCgigIVThs6aHp813J1ohGvEBqAWaaIpe-yqJ7lTOlO_p-Txs2ibLdR-9Da0njKXmMqUpC9dXrkS8sd1tSoAsXOZF15zaUBQ?session=0&fife" height="200" width="auto" /><br><br>Закрытая атомная электростанция в южной Италии.<br><br>АЭС Гарильяно расположена в провинции Казерта (Кампания), рядом с первой итальянской АЭС — Латина. Атомная электростанция названа по имени протекающей в этой местности реки. Строительство станции под руководством архитектора Риккардо Моранди началось в 1959, а завершилось в 1964 году. Всего на станции был установлен один реактор кипящего типа BWR. Мощность АЭС Гарильяно составила 160 МВт. В 1978 году АЭС Гарильяно была остановлена на профилактику реактора, а 1 марта 1982 года станция была окончательно остановлена — за четыре года до знаменитой Чернобыльской аварии.<br><br>Чернобыльская катастрофа оказала важнейшее влияние на развитие итальянской атомной энергетики. Проведенный спустя два года после аварии общенациональный референдум привел к решению об остановке всех атомных электростанций в Италии.<br><br>В 2011 году Италия подписала контракт с французской компанией Areva на переработку 13 тонн отработанного ядерного топлива с АЭС Гарильяно. После переработки отходы будут возвращены в Италию к концу 2025 года";13.8343304;41.2586104;0
Италия - АЭС Латина;"<img src="https://doc-14-04-mymaps.googleusercontent.com/untrusted/hostedimage/67ht0gn364521qiheeia79564g/0dlv9bcp21pspirc4g5r6bjutk/1595361600000/FTCPzVzQEZ0A9SJ2YuS7DeTeOtpcj_VS/*/6AF2TALocNR1Uc-_D9JqvqRuKMz5hKgqB3Ku1-t62D4R8Vj2v5m5oci1SRbS72aaNz6iItz2M_-9J_dNpSyFXv0Nd_Nbas2JeSuU3U3Dnl_YSrDA4f2AQaYI33fxQX6UCixaBd8fv5HB8YbjVqcKLJmGu6SdpdkS1b95qcTFar5NGmCMDvWeghKqlAZtWMZYuzWwQd_cYYPaMxqgVlzsp99wCFevZ16t68LaqbVHgY9Wtsma3VXnK6RlcO4zfGDPLCypOW7c1FbWNZFgajChJ7sntCCMBy-CwaA?session=0&fife" height="200" width="auto" /><br><br>Закрытая атомная электростанция в центральной части Италии. Станция расположена в провинции Латина области Лацио, в 62 км на юг от Рима.<br><br>Атомная электростанция Латина была заложена в 1958 году, а в 1963 дала первый ток в энергетическую систему страны. На станции был установлен газоохлаждаемый реактор типа Магнокс. Мощность единственного за всю историю станции Латина реактора составляла 160 МВт при проектной в 210 МВт. Таким образом, мощность АЭС Латина никогда не превышала 160 МВт. На момент запуск атомная электростанция Латина была крупнейшей АЭС в атомной энергетике Италии и всей Европы. Однако, на все сто процентов реактор никогда не работал, из-за возможных проблем с окислением стали компонентов реактора при его полной нагрузке.<br><br>Закрыта атомная электростанция Латина была в 1987 году, через год после аварии на Чернобыльской АЭС в СССР, при том, что срок эксплуатации реактора был рассчитан как минимум до 1992 года, без учета возможных продлений. А все потому, что в стране был проведен специальный референдум по вопросу работы атомных электростанций, поставивший крест на атомной энергетике Италии. В 2006 году были демонтированы конструкции реакторного здания АЭС Латина, в 2008 — снята турбина, в 2012 — демонтирован сам реактор Магнокс.";12.8073695;41.4253446;0
Италия - АЭС Каорсо;"<img src="https://doc-00-04-mymaps.googleusercontent.com/untrusted/hostedimage/67ht0gn364521qiheeia79564g/ut7ht9rdgmmmmqc0ofpjlsnlt0/1595361600000/FTCPzVzQEZ0A9SJ2YuS7DeTeOtpcj_VS/*/6AF2TALpN9fANMMv9R-9K-mtLkhnPbjFh7SFnEeeW3g5Q7s5jbEObNq5XlSIg2PLYiC5_vY7wKNCbaFQU_IGPysQuggOwmQktKvYi2-fB-ZWElSPyNmTRccbtP7kisFHhZsYzJkj5noFW0pH-1YUDvp1CQs9IuHfeGOIsDsaZIbkoACKI_UYqZbL-Q7mpbv1NhBHas-24fnDfkE7h4mkvhxZv3PxFTbUcglQrZ8o4fQuSZ_ctaT-xwyxZqn1Ad0wzUBMRKlId0iTfsoSMtvSWIB-6MMBGJbwj8Q?session=0&fife" height="200" width="auto" /><br><br>Закрытая атомная электростанция в центральной части Италии.<br><br>АЭС расположена в провинции Пьяченца области Эмилия-Романья. Строительство АЭС Каорсо началось в 1970 году и завершилось в 1978. Единственный реактор АЭС Каорсо относился к типу кипящих водо-водяных BWR. Его мощность, как и мощность всей АЭС Каорсо, составляла 882 МВт. Каорсо в период своей работы являлась самой современной и самой крупной АЭС Италии. В 1986 году после аварии на Чернобыльской АЭС реактор на станции был временно остановлен. А уже после общенационального референдума, вызванного Чернобыльской катастрофой, атомная электростанция Каорсо была окончательно закрыта в 1990 году – последней из всех итальянских АЭС.<br><br>Закрытие АЭС Каорсо окончило историю атомной энергетики Италии. Однако годы работы атомных электростанций страны не прошли бесследно. Значительно количество отработанного ядерного топлива продолжало храниться на территориях станций. В 2011 году правительство Италии заключило договор с известной французской компанией Areva. По договору, в частности, будут направлены 190 тонн отработанного ядерного топлива на переработку во Францию с последующим возвращением в Италию к 2025 году";9.8712636;45.0724108;0
Италия - АЭС Энрико Ферми;"<img src="https://doc-14-04-mymaps.googleusercontent.com/untrusted/hostedimage/67ht0gn364521qiheeia79564g/oi1kj116sclp0pcuftkbsg5jpg/1595361600000/FTCPzVzQEZ0A9SJ2YuS7DeTeOtpcj_VS/*/6AF2TALrDBt9RhNa3eTVOGKwAuKcS_xlUepk6H9ghtat38kQSARiNBt-3dfWjyzjzVNh8qVcLmPgxr1664wcgdEpELd4fJWdcvZB0KG3Jfr1gh-wi8XfIvHjLISKZdPt2dOaQjCpYK23k1fYE-F6MTDYONkGH1gTZpLC7BARMwMMSscRE9W2CC8soZ7rVCG38pfbr0IESCSZGH4XG2oNWjZOOy7v3H16rQQTXBqtOyXRtme3FqAWtnnW1yXgc2RMl9admY-nIPvz59AioKgten1f9hG2IDPwMRA?session=0&fife" height="200" width="auto" /><br><br>Закрытая атомная электростанция на северо-западе Италии. Названа в честь знаменитого итальянского физика-ядерщика Энрико Ферми. Интересным является тот факт, что в США также располагается АЭС с названием Энрико Ферми.<br><br>АЭС Энрико Ферми расположена на левом берегу реки По в коммуне Трино провинции Верчелли (Пьемонт). Строительство АЭС в Трино, второй АЭС в Италии, завершилось в 1964 году, когда был запущен первый и единственный реактор с водой под давлением (PWR) мощностью 260 МВт.<br><br>В начале 1980-х был разработан план по развитию атомной энергетики Италии, который в том числе включал в себя строительство новой электростанции рядом с АЭС Энрико Ферми. Станция должна была состоять из двух реакторов мощностью 1000 МВт каждый. Однако, по решению общенационального итальянского референдума 1987 года, АЭС Энрико Ферми была остановлена в 1990 году. Вывод из эксплуатации АЭС в Трино завершится к 2024 году. Таким образом станция Энрико Ферми станет первой демонтированной в Италии. Для этих целей осталось утилизировать более двухсот тысяч тонн отходов, включая 2 тонны радиоактивных";8.2777066;45.1838533;0
