kml_name;kml_description;longitude;latitude;height
Россия - Татарская АЭС (Камские поляны);"<img src="https://lh6.googleusercontent.com/proxy/KyGQROxa1Y8eiHxqP4DXzmTloAHjAWpQTOCdvayHJNEyUGD_mD6_L3Sa1WCf8w6nrIRGkkHyBh05cTaoOP8Y6WmQpKa1pu_NGuGyfnzNrT5TTpme67tnUoYQw_ch4VZ2rQKOVkCIpwQ3Whl9ClOBWqlyrmG9od_ngf43-UNnhM6Te2_KczLIBgAK_pBFkE7WuaC53MHjCk4oAb--5QnQJ4EjcSd7_k9EJGwf4ZPCEeeRk3Cj7rrMyQ" height="200" width="auto" /><br><br>Недостроенная атомная электростанция, расположенная вблизи посёлка городского типа Камские Поляны на берегу реки Кама, Республика Татарстан. В 1990 году под давлением общественности после аварии на Чернобыльской АЭС строительство Татарской АЭС было остановлено. Она повторила участь однотипных ей недостроенных Башкирской и Крымской АЭС.<br><br>В 2013 году вышло Распоряжение Правительства РФ от 11 ноября 2013 года №2084-р "Об утверждении схемы территориального планирования Российской Федерации в области энергетики".[2], согласно которому предполагалось строительство двух энергоблоков ВВЭР-1200 по новому проекту.<br><br>1 августа 2016 года вышло новое распоряжение №1634-р[3], согласно которому количество планируемых энергоблоков сокращено до одного, а срок ввода в эксплуатацию сдвигается до 2030 года. Предполагалось что энергоблок будет построен по новейшему проекту ВВЭР-1300/B-510. Однако в Распоряжении Правительства РФ от 9 июня 2017 года №1209-р «Об утверждении Генеральной схемы размещения объектов электроэнергетики до 2035 года» планы на ввод в эксплуатацию Татарской АЭС до 2035 года отсутствуют.";51.289889;55.451412;0
Россия - ФГУП «Производственное объединение «Маяк»;"<img src="https://doc-0c-04-mymaps.googleusercontent.com/untrusted/hostedimage/67ht0gn364521qiheeia79564g/rnvhb0quf3iecp1j8tscmjiei0/1595361600000/FTCPzVzQEZ0A9SJ2YuS7DeTeOtpcj_VS/*/6AF2TALoZIYUH3T3EbZRci7aWa5PcLOu552gMIQLtj_DcSByhI5hfBGs8UOP1i7N4ayx4aS-aB92uNDZmViEPW33-L_JXWrrGEDTE73Ilo-z8kCoI5GaRc2zfyC2WqBaLtGgX-GteoxW-i53YoHQU9RUXi1JIANifkk7V7s6othTmSHkew1pJI7uoGIsdY2JoWAUZ15_IOIdMXUxHtKtqwZ0bczpSp-TCe-K8LuSyf90K5ZajBxqT7sb3k7V17th3Koip2rhAwx-86EGV5bdE89K81qjKKRPwTg?session=0&fife" height="200" width="auto" /><br><br>Предприятие также с 1948 года производит оружейный плутоний, первый реактор А-1 был запущен 19 июня 1948 года[2]. В 2009 обсуждалась вероятность переноса этого производства на Сибирский химический комбинат, однако в марте 2010 «Росатом» признал это нецелесообразным.<br><br>На предприятии также осуществляется хранение, переработка, утилизация радиоактивных отходов, в том числе путём цементирования и остекловывания (перевод некоторых жидких радиоактивных отходов в твёрдые)[4][5][6]. Проектная мощность — переработка до 400 тонн отработанного ядерного топлива в год. Кроме переработки, на предприятий производят источники ионизирующего излучения для разных сфер деятельности.";61.68963209999999;55.8495058;0
Румыния - АЭС Чернаводэ;"<img src="https://doc-0o-04-mymaps.googleusercontent.com/untrusted/hostedimage/67ht0gn364521qiheeia79564g/61gqqg2ue73r63v1e3ng7dn5mk/1595361600000/FTCPzVzQEZ0A9SJ2YuS7DeTeOtpcj_VS/*/6AF2TALpiXkz2-zIXlM__ShA76Hrt3720zUPa6fh0s4OdvygjhConaW2X2QM_ny0bMbHRu04GdlAWwNpeEr1LZgkn3W-gdsbAoKuBDic_Hxo1ML44WEfpmsqYU7EI1uZ9LRY_dwWdMb02O_6V8Djkn42_ODLdwvNgGf06RUcZZyHWtfv9ZTx4TOU-acmkMM8IQqtv46XQiT1lYfKQwlUOM4OlwLTPlwtOXDqj5FQtQHYzVtjHGpxkfSWUWDtxVBPWhAkYYXOw2JJ1Sbc8LZU5LdZG7DWsRNmq9Q?session=0&fife" height="200" width="auto" /><br><br>Первоначальный проект станции предполагал сооружение пяти энергоблоков. Сейчас в промышленной эксплуатации находятся два энергоблока с реакторами PHWR (CANDU). Ещё три частично построенных блока (также с реакторами PHWR) расположены на той же площадке. Их строительство было остановлено в 1990 году. Правительство Румынии намерено достроить третий и четвёртый энергоблоки. О завершении пятого блока речь пока не идёт. За сохранность трёх недостроенных энергоблоков отвечает CNE-INVEST.";28.0581003;44.3177861;0
Северная Корея - Ядерный научно-исследовательский центр в Йонбёне;"<img src="https://doc-0c-04-mymaps.googleusercontent.com/untrusted/hostedimage/67ht0gn364521qiheeia79564g/gkdp7j5ahr7d48uum6bt5sjvpk/1595361600000/FTCPzVzQEZ0A9SJ2YuS7DeTeOtpcj_VS/*/6AF2TALqyHYfcWfwludiAV1RmnehXrFfLONBd-IaLLei_RlUyieiKMldzv8qiGeqoFBb_hTyGZKjq60C36_2Xtp012E6BzxlwAXL-tkWSRL7sB_fy5GgPzdytVA7ukE_EEhkFDkfzLp_bUnCSrXsLBYNyylnz_lsjjLqveXuHAg7YZvQZfhz4W9sPF3RzkzoIgOyM8cDtekgvrHGm7fbKAsjm8WwGY4snRtAZYfJ9gJV2URE4S0UgQRfOwGk3l8Yb1l9iw5FgNy-2r0_Kx4fiRGjdOuqGW1UuvQ?session=0&fife" height="200" width="auto" /><br><br>Ядерный научно-исследовательский центр в Йонбёне — крупнейший ядерный объект КНДР, управляющий первым ядерным реактором. Расположен в Йонбёне (провинция Пхёнан-Пукто).<br><br>Основан в 1964 году при содействии СССР.<br><br>В 1965 году введен в действие советский ядерный реактор ИРТ-2000 мощностью 2 мегаватта. <br><br>Йонбен является фактически главным центром по проектированию и изготовлению ядерного оружия. Исследовательский центр атомной энергии, в состав которого входят: Институт ядерной электроники, Институт ядерной физики, Институт радиационной химии, Институт изотопов, Радиохимическая лаборатория, Критическая сборка мощностью 0,1 МВт, а также 3 реактора: реактор мощностью в 5 МВт, реактор тепловой мощностью в 8 МВт и реактор мощностью в 50 МВт. Также в составе центра действуют завод ядерного топлива, предприятие по переработке изотопов и полигон для испытаний взрывных устройств.<br>Ядерные объекты в Йонбене:<br>1. Сунчхон, Унги, Хыннам. Действующие урановые рудники.<br>2. Кусон. Предприятие по переработке урана, получение UO2 - диоксида урана.<br>3. Наннам. Исследовательский центр ядерной энергии.<br>4. Пакчхон. Действующий урановый рудник и обогатительное предприятие, исследовательский центр атомной энергии. Предположительно в данном центре ведутся разработки ядерного оружия.<br>5. Пхенсан. Производство диоксида урана, Предприятие по добыче и переработке урановой руды.<br>6. Пхенсон. Исследовательский центр атомной энергии и Пхенсонский научный университет.<br>7. Пхеньян. Колледж ядерной физики в составе Технологического университета им. Ким Чхека и Колледж ядерной физики при Университете имени Ким Ир Сена.<br>8. Хамхын. Университет химической промышленности, занимается подготовкой специалистов в области переработки ядерных материалов.";125.7550515;39.7973225;0
Словакия - АЭС Богунице;"<img src="https://doc-00-04-mymaps.googleusercontent.com/untrusted/hostedimage/67ht0gn364521qiheeia79564g/p25kml13fk3clgcu893b5p38io/1595361600000/FTCPzVzQEZ0A9SJ2YuS7DeTeOtpcj_VS/*/6AF2TALriceu03tA43-dHBdLh8mcvkf1wxrq4FGy526_Cn17pKj3AZRaaKoLRHtsq_Fv6d_qhjDpTzniyDwKJAiiyCtRCfHCrua5WP6BPD-V9O-G108pBTd7fjprIL81HkUEgF7CmdB-jEHHavceJj5n5pM3a8_wl7Alt-u6hNOr6jQlVm-IA0BNZfGOcatGdHVxeZMtlZsc1vk4aUDtADkiP9e2kfzPj709DfBG9mkeLODRULBEe0--BjHQJGhhTUm8KES-UT3Lw1MLMgR2nIRrmGuVxWbEO-Q?session=0&fife" height="200" width="auto" /><br><br>Станция расположена близ посёлка Ясловске Богунице в 14 км на север от Трнавы.<br>    На территории станции находится энергоблок А1 с тяжеловодным реактором с газовым охлаждением советского проекта КС-150. Реактор был изготовлен компанией Skoda и запущен в 1972 году, после 14 лет строительства.<br>     Две очереди (V-1 и V-2) состоят из двух энергоблоков с реакторами типа PWR советской модели ВВЭР-440 каждая. При вступлении Словакии в Евросоюз было подписано соглашение о выводе из эксплуатации двух энергоблоков V-1. Первый реактор был остановлен в 2006 году, второй в 2008 году]. Таким образом, действующими являются два энергоблока ВВЭР-440 второй очереди (V-2).";17.677115;48.49170969999999;0
Словакия - АЭС Моховце;"<img src="https://doc-14-04-mymaps.googleusercontent.com/untrusted/hostedimage/67ht0gn364521qiheeia79564g/6bda2ailcd6i2dlfpdc0gptl9s/1595361600000/FTCPzVzQEZ0A9SJ2YuS7DeTeOtpcj_VS/*/6AF2TALq2TDFbJf7sASJJnuu4z_2FokmEHNfhJcuMEjqa9B8a_PBr5xZalBiuXv6_4AmSLeLdiR5XjSChzo_RlI4rBLSPtlAGeAPSMXI1Xzq8lnryNJxAJT069TPHuFx-deCefMmDGKpweElACODxGyVnEE1sJ1z0zlNEifQSmzRSIN8iLjz9WygTmgYzWWjuxzdIXcmQu4EGsrRwECYL7KYwUBNpXjstjRQqKYmmF-o_Ck2xAMKzSaS6Y-iMDjkqN9nMDwTm6AXWvab6ZlOOGpoSs53Fg3h5WQ?session=0&fife" height="200" width="auto" /><br><br>Станция расположена в 15 км на северо-запад от города Левице. Текущая мощность АЭС Моховце, на данный момент, покрывает около 20% потребляемой электроэнергии в Словакии.<br>     Начало строительства первой очереди станции с реакторами ВВЭР-440 мощностью 470 МВт было положено в октябре 1983 года. В марте 1993 года строительство было официально приостановлено, однако уже марте 1996 года вновь возобновлено. В настоящее время оба реактора ВВЭР-440 первой очереди находятся в работе.<br>       Строительство второй очереди с аналогичными реакторами стартовало в январе 1987 года. В марте 1993 года строительство было приостановлено, решение о продолжении строительства было принято в июне 2009 года. Предполагаемые сроки завершения проектов — 2018 год для 3-го энергоблока и 2019 год для 4-го энергоблока";18.4584105;48.2631319;0
Словения - АЭС Кршко;"<img src="https://doc-10-04-mymaps.googleusercontent.com/untrusted/hostedimage/67ht0gn364521qiheeia79564g/fafussbe02rh7ne3v3m40s2rfg/1595361600000/FTCPzVzQEZ0A9SJ2YuS7DeTeOtpcj_VS/*/6AF2TALpJVVReXXmcYbfwn0FrQXjAHTIWIe49pEzH0ohjlKFB6dZzo4aqPwkAhyWgonQNk5kt1IU7DoALk_gjF0AihVHA8D_p2Am2022Oafupv2Ya0LW140Izz-oUKgkeuihClwpcCp7_s3nk8z8CJbZfv5xhNZyXuVylpJCoRiT01ROYQdcXlytWeK0W6J0NkGCvxj_6K5iaEWgz1c-eHs24rNJy9QEeYaWswA97Ic3PugcAjII9N9z_2VARg_FHIhHadVzmKxgx8z_qXAur3mBRd-J2O6Y2ag?session=0&fife" height="200" width="auto" /><br><br>АЭС в Кршко, Словения, построенная в качестве совместного предприятия Словенией и Хорватией, входивших на момент строительства в состав Югославии. В состав АЭС входит единственный блок с водо-водяным реактором (PWR), разработанным и построенным американской компанией Westinghouse. Станция обеспечивает около 25% потребности Словении и 15% потребности Хорватии в электроэнергии.";15.5152886;45.9381211;0
США - АЭС Арканзас;"<img src="https://doc-0s-04-mymaps.googleusercontent.com/untrusted/hostedimage/67ht0gn364521qiheeia79564g/i8utfdkkl070hggv5dabm0b104/1595361600000/FTCPzVzQEZ0A9SJ2YuS7DeTeOtpcj_VS/*/6AF2TALrj2l44qjJQ_GcjFhhFdGNgnRby5b1682A6iMbusyD4sdH6KwNBuImr_k9CFMX814ABr2mvAt1Wz5YYUOQ9a0VH3KKk156aUDCzCT-SxH2ncOHGNEK_HsXUL5QYQISj8WAxmMQv-UbysXtO7Jn1IPi1Nkg-Trg5HwUevMbp2WrEcGPchQ3G1OyOxHUY0IoumLj-kraH5WyEjdDkmVgcui7y_40tmfD-CoeTDkN4ccaytVxdtUfuDmjkYciPbDE97blCchIVCmcHrqshagBZhmwJgGIKZw?session=0&fife" height="200" width="auto" /><br><br>Первый блок, установленная мощность энергоблока 846 МВт, был запущен 21 мая 1974. Лицензия на эксплуатацию энергоблока действует до 20 мая 2034<br><br>Второй блок, мощностью 930 МВт был введен в эксплуатацию 1 сентября 1978 и проработает до 18 июля 2038. Блок был построен компанией Combustion Engineering. Второй блок для охлаждения реактора использует градирни, в то время как реактор первого блока охлаждается путём передачи тепла озеру.";-93.2309246;35.3108337;0
США - АЭС Байрон;"<img src="https://doc-0k-04-mymaps.googleusercontent.com/untrusted/hostedimage/67ht0gn364521qiheeia79564g/roksv5k2ki6grdkcnfvb6lqu4s/1595361600000/FTCPzVzQEZ0A9SJ2YuS7DeTeOtpcj_VS/*/6AF2TALrrSJTDe5X8ogacy86lIa2_Qnf8PNE0OayMNVd4LJnNZ9znn8B6gokzYzf9SR60FR4iKg9sdFrrVeqfPSY3ciJvoOeRO3cDHgL5UuEqQA9hDOE6Isfkecun5RW30R1DpF44e-55NkeY8Y1sANEZqPL0wBiJlQGl61wFQO5sGtwIUli-uB9jIevbJF7SUQrhyQ8gMvPcaE4Z48v3wI3DRzBG1-Jlf9jMBcQRazNz6Fw9r5VmGLXZ1biNYtc_7mB87nZzeb796UFuh7gS0yYu2u8BVbcXgQ?session=0&fife" height="200" width="auto" /><br><br>действующая атомная электростанция в центральной части США.<br>АЭС Байрон (Byron Nuclear Generating Station) – действующая атомная электростанция, расположенная в штате Иллинойс, Соединенные Штаты Америки. Оба реактора АЭС были запущены в 1985 и 1987 годах соответственно. Мощность первого составляет 1 225 МВт, второго – 1 196 МВт. Оба они относятся к типу PWR с водой под давлением. Общая мощность АЭС Байрон в Иллинойсе составляет 2 421 МВт на 2016 год. Станция обеспечивает электроэнергией весь северный Иллинойс и частично столицу штата – Чикаго. Срок службы АЭС был ограничен для первого и второго реакторов – 2024 и 2026 годами, соответственно. Но в 2015 году он был продлен на двадцать лет дополнительно для обоих реакторов.<br><br>Еще в период строительства АЭС Байрон, местное население высказывало крайнее недовольство по этому поводу. Во многом по этой причине строительство первого энергоблока растянулось на десять лет – с 1975 по 1985 годы.<br><br>В 2014 году появилась информация о возможном закрытии пяти энергоблоков в США по экономическим причинам. Это касалось двух реакторов на станции Байрон, двух реакторов BWR на станции Квод Ситис и одного реактора BWR на станции Клинтон.";-89.2826238;42.0776797;0
США - АЭС Бивер-Валли;"<img src="https://doc-0o-04-mymaps.googleusercontent.com/untrusted/hostedimage/67ht0gn364521qiheeia79564g/alipejhv7691su756518kh73mc/1595361600000/FTCPzVzQEZ0A9SJ2YuS7DeTeOtpcj_VS/*/6AF2TALrTI_Ubjzq2HJE4y7PqdhYuBhywu01wAvARaXVHD9oXed42dbU2vhBmsxK5fVeu5nifIEnyMk29pGWKi_wIm4-4sPMmnKB75P02ngC8gPMgohDiR5tyYih2ABFbdUAXvHn7TsDdKqwxi_5UKgwzLhbVHlmp_FTbK0jJZ4j3UXC1JAA4ceK-ioeT5W7fczolSPXcl1c0qTnM8G2EUzvnh-UkXyFOTvCHR-OQx9Q96f_9IFi0y-UKttJAtdYoOROZJtovWFKqqUfxFB_C5-CsLwTZ5VkQgA?session=0&fife" height="200" width="auto" /><br><br>действующая атомная электростанция, расположенная на берегу реки Огайо в штате Пенсильвания в США, близ первой американской АЭС – Шиппингпорт и в пятидесяти километрах от трехсоттысячного города Питтсбург. В 1976 году был подключен первый из двух энергоблоков станции Бивер-Валли. Мощность реакторов составляет 923 МВт каждый, тип – PWR – реактор с водой под давлением. Мощность АЭС Бивер-Валли на 2017 год составляет 1 846 МВт.<br><br>Станция Бивер-Валли использовалась в качестве эталона при строительстве старейшей из действующих французских АЭС – Фессенхайм.";-80.4322815;40.6226237;0
США - АЭС Биг Рок Поинт;"<img src="https://doc-0c-04-mymaps.googleusercontent.com/untrusted/hostedimage/67ht0gn364521qiheeia79564g/vkest07f24sea0itaipnt7kfio/1595361600000/FTCPzVzQEZ0A9SJ2YuS7DeTeOtpcj_VS/*/6AF2TALq9N6eYjQmPp6McbA5fxXDAuqgEtiB0OaYgik4DIQS7FjHxT1WwMLx94iD4iLMA16nnVUscpoZIczO-ZzdTsJ3p5clBVmMLybK3tsOT2MMZsXY848RtX8STbaGrz3jDwehoKvhETdTZ4qKbiYtavqm5pAoZOhGb1ATE_2EMiG_Ga9-FXHWFtOolQLaZ24XfHMpHucQJifGUU8TcVgALIOFFna_VNXdqI9dTtQ7Z4GIlGGaTA-tZsU2f-NnBJoXCJrv_tnjIFOAUyvxbmHIrg3PoQAgrNg?session=0&fife" height="200" width="auto" /><br><br>АЭС Биг Рик Пойнт (Big Rock Point NPP) – закрытая атомная электростанция, расположенная в штате Мичиган, Соединенные Штаты Америки. Строительство одноблочной АЭС началось в 1960 году, а спустя два года она уже заработала, став первой АЭС в штате Мичиган и пятой по счету атомной электростанцией США. Также в штате Мичиган действовали следующие атомные электростанции: Палисадес, Дональд Кук, Энрико Ферми. До 1997 года – года закрытия АЭС Биг Рик Пойнт – станция работала на мощности в 71 МВт с реактором типа BWR-1. Срок эксплуатации реактора при этом позволял работать до 31 мая 2000 года. Но чисто экономически Биг Рик Пойнт была крайне дорогой АЭС, с учетом малой мощности единственного реактора.<br><br>Дезактивация станции была завершена уже в 1999 году, а в 2003 корпус реактора перевезли в хранилище в Барнуэлл в Южной Каролине.<br><br>На месте АЭС Биг Рик Пойнт планировалось разместить парк с музеем и хранилище отработанного ядерного топлива, в котором сейчас расположены свыше четырехсот топливных сборок. Однако на текущий момент вопрос с продажей территории бывшей АЭС в частные руки так и не решен.";-85.195381;45.3597223;0
США - АЭС Бонус (Boiling Nuclear Superheater Reactor Facility);"<img src="https://doc-10-04-mymaps.googleusercontent.com/untrusted/hostedimage/67ht0gn364521qiheeia79564g/5a3rl7844i5p2en4kpuvqgljng/1595361600000/FTCPzVzQEZ0A9SJ2YuS7DeTeOtpcj_VS/*/6AF2TALrwlDOQewkdrOlYWoCD4-xbE9y1bOYowQm00oBDtCVoulbVI-YAXrIzWaU755Vyfqj6AAptlhEz9ZbsGKcMOiQVFoYDzDv5UPfPOyYZWT6NW-mavrzKEsOXLWAxOZZ1afP2EoJ2yQhBTngS2tByQ7Wi8X17PwA7fXZ0biZ3cyv6zzAB5AOEQT8qbbft5zTDByax27CXdEkWmoyZRdydrKXHIlg6Gyg-J9toAiJxQHszC4nDThBxqbrekK9yJ9iE7hrm9M6xTxGS0bD98x8oLQVVQdTw0w?session=0&fife" height="200" width="auto" /><br><br>АЭС Бонус (Boiling Nuclear Superheater Reactor Facility – BONUS) – закрытая атомная электростанция, расположенная на островах Пуэрто-Рико близ города Ринкон в Соединенных Штатах Америки. Строительство этой одноблочной станции началось в 1960 году, а спустя четыре года она уже заработала, став первой и единственной АЭС на островах Пуэрто-Рико и пятой по счету атомной электростанцией в истории атомной энергетики США. На станции был установлен единственный реактор мощностью всего в 18 МВт, проработавший всего четыре года. Из-за технических трудностей реактор был остановлен в 1968 году, но, официально закрыт только в 1985 году. BONUS являлся прототипом концепции реактора интегрального типа. Демонтаж станции проводился в несколько этапов. Основная масса оборудования была перевезена на территорию материкового части Соединенных Штатов Америки. А последний этап дезактивации был проведен только в начале 2000-х годов.";-67.2683833;18.3654083;0
