kml_name;kml_description;longitude;latitude;height
Тайвань - АЭС Тоушен;"<img src="https://doc-04-04-mymaps.googleusercontent.com/untrusted/hostedimage/67ht0gn364521qiheeia79564g/85he4dhb55qjjrkpor0iio0nc8/1595361600000/FTCPzVzQEZ0A9SJ2YuS7DeTeOtpcj_VS/*/6AF2TALo5hX7hoiTv7O-HWtvXm2u2YX40C5JkhHWQ2w368WuKMPLeNOtFYsgLEWnX3b7LPmRWoCynDXdchPDDBDt7YBWwMohS8yyZnQ06FWPseLPywJpJWEPsttjImeIxTNl2v1S3ToUPDNlhhMcqeVBQXx1z8o3WxElg9xBDOC4C9R-qAwtiRgIzACqVzuuZxLDYByd_ixaPtscenMqlAt3HaKvqgjRwz7VHcrlVlocI_BsuIJIszwVkDSPbUOgUTaT0u1nMxzakzMQ31MS3Ov-DLGq-HXtxqg?session=0&fife" height="200" width="auto" /><br><br>АЭС Куошен (первый блок был введен в эксплуатацию в декабре 1981 года, а второй в марте 1983-го) ежегодно производит до 16 миллиардов кВт*ч. Сегодня это наибольшая действующая АЭС на Тайване. Первый энергоблок планируется остановить в 2021 году, а второй — двумя годами позже.";121.6625472;25.2032104;0
Тайвань - АЭС Цзиньшан;АЭС Цзиньшан введена в строй в 1978 году. Она генерирует до девяти миллиардов кВт*ч электроэнергии в год. Фактически ресурс хранилищ отходов ядерного топлива ее на сегодня исчерпан. Согласно официальным планам правительства, первый энергоблок будет остановлен в декабре 2018 года, а второй — уже в июле 2019-го.;121.5876313;25.28638430000001;0
Тайвань - АЭС Мааншан;"<img src="https://doc-00-04-mymaps.googleusercontent.com/untrusted/hostedimage/67ht0gn364521qiheeia79564g/9cs7hg9g409kh3bf6c11511roo/1595361600000/FTCPzVzQEZ0A9SJ2YuS7DeTeOtpcj_VS/*/6AF2TALqbPHpvXZYq5OKaWku4avhfSKs_TGWrmls3JyD7XlOAs2WJw7dcCl6ou6Nd726wDgLuxhC_M89GfNN4odBw0Ioizco-QEJ388JkV1ksSagBWe_qiiB1R10R-rZEqK6ow4O1F8Z7TV2dflPvsV6n7jRvthjf5FhKxXiepxbzZQXTW0pY6TmXN2Zp-Yp4yPtgHoK-Wu0m-_SH5hZVk0Np1a-Ak5va-35a-KJsY7F7QBM5Czd24I7kyEi9JftDmF40rir6d4rSIh73yyHgRS61LKUjBLOxLg?session=0&fife" height="200" width="auto" /><br><br>АЭС Мааншан — самая молодая станция страны. Первый блок начал свою работу в июле 1984 года, а второй — в мае 1985-го. Проектный срок эксплуатации составляет 60 лет. Ежегодно предоставляет потребителям около 15 миллиардов кВт*ч электричества. Ее тоже не миновал топор борцов за все доброе и зеленое. Лицензии на реакторы истекают в июле 2024-го и мае 2025 года, именно эти даты предварительно считаются концом эксплуатации.";120.7515982;21.9580977;0
Тайвань - АЭС Лунгмень;"<img src="https://doc-0s-04-mymaps.googleusercontent.com/untrusted/hostedimage/67ht0gn364521qiheeia79564g/5qb9m6jgc7emob15r0p0i66gp4/1595361600000/FTCPzVzQEZ0A9SJ2YuS7DeTeOtpcj_VS/*/6AF2TALq-7Q2JKids9mGgTUB76VSvfar5TxO72Nu7ij6ke-1wXKFW18-bJHS25i_uy3IcaW21mirmeV-OcQV2npwlahEqWMqnlrxIYowEuT-B3V3ltCn2J1-x1e9VtpKPY6WAWpocOzdL7Sxui0-T6l-58Sg4imEzLRdq2UW0XHurhHZ9cnzB2WYP_06qqDPZhH8tvT_zMMN_3j8SjySWm-ouYNCVQ962Y3Jo544KjUKJivfc35RIoTMKnutHLoZJPLEB-0gARXkX1mB1yG61U8jxGyodgNIxvQ?session=0&fife" height="200" width="auto" /><br><br>В августе 2014 года, на десять лет позже установленного срока, АЭС Лунгмень была практически готова, на ней были проведены практические испытания 126 основных систем: охлаждения, аварийного отключения, обнаружения загрязнения, электрогенерации и многих других.<br>    Многострадальная АЭС Лунгмень так и осталась памятником несостоявшимся надеждам и громадным деньгам, потраченным в никуда. В 2015 году Taipower аннулировала контракт с компанией Westinghouse на покупку 1744 ядерных стержней.";121.9247273;25.0385473;0
Турция - АЭС Аккую;Строящаяся атомная электростанция на южном побережье Турции. АЭС «Аккую» сооружается по российскому проекту, включающему в себя строительство и ввод в эксплуатацию четырёх энергоблоков с реакторами типа ВВЭР-1200. Соглашение о строительстве станции было подписано в мае 2010 г.<br><br>3 апреля 2018 года в ходе совместной церемонии в Анкаре Президент Турции Реджеп Тайип Эрдоган и Президент России Владимир Путин по видеосвязи дали начало строительству станции.<br><br>Электрическая мощность каждого блока турецкой АЭС составит 1200 МВт, общая — 4800 МВт. Согласно подписанному 10 мая 2010 г. в Анкаре российско-турецкому межправительственному соглашению эксплуатация первого энергоблока должна начаться в течение семи лет после получения лицензии на строительство. Предполагается, что блоки будут вводиться в строй последовательно с интервалами в один год, начиная с 2023 г. Общая стоимость строительства АЭС составляет 22 миллиарда долларов США;33.5420715;36.146843;0
Узбекистан - Узбекская АЭС;Узбекская АЭС – планируемая атомная электростанция в республике Узбекистан в Средней Азии. В 2014 руководство Узбекской республики заявило о возможности строительства единственной атомной электростанции в Средней Азии. Вместе с тем в регионе уже работала Шевченковская атомная станция в Казахстане, основной целью которой был процесс опреснения воды.<br><br>Причина начала разговоров о строительстве своей атомной электростанции – подход потребления электроэнергии в Узбекистане к верхнему уровню возможностей ее производства в стране. Вместе с тем 75% всех мощностей в стране рассчитана на газ и правительство надеется диверсифицировать сырье для производства электроэнергии (в 2014 году еще сохранялись высокие цены на газ). В свою очередь освободившиеся объемы газа можно было бы отправить на экспорт на продажу. С другой стороны, Узбекистан – один из крупнейших поставщиков урана на мировой рынок, что снижает себестоимость сырье для атомной станции.;66.2431441;41.0878561;0
Украина - Запорожская АЭС;"<img src="https://doc-0g-04-mymaps.googleusercontent.com/untrusted/hostedimage/67ht0gn364521qiheeia79564g/p0s85cm8kfava1av4m4e37r4no/1595361600000/FTCPzVzQEZ0A9SJ2YuS7DeTeOtpcj_VS/*/6AF2TALqkI_IiVXFyTj3w5YjXJJqr5W_g30KT0wiTRx4QPGVSVmIABewo28e2JHuMR808x2oUunga4kSMnxNuhBHwSqYSyNjMOfReEJOlY21nWopWiO-pv21Yju0WDpWsF3Kj7oITD2RMBdmLo_f3WWOgDlgOdw22ZpttQxV4YJhEnDyoTxsmDVaM3FI2dfFvZAVDHCXtJFHMISoLTUuOgRoekt2aAAcvgTm-zi91SNFPm_v906Q1de0JLoLMQXBIwg28iXIgaA_SHGaVkStiBlBPtqWZkPopvw?session=0&fife" height="200" width="auto" /><br><br>Решение о строительстве ЗАЭС по унифицированному проекту атомных электростанций с реакторами типа ВВЭР-1000 было принято Советом Министров СССР в 1977 году. В 1979 году началось строительство Запорожской АЭС, что дало мощнейший импульс экономическому развитию региона[6]. В 1980 году утверждён технический проект строительства первой очереди Запорожской АЭС в составе 4-х энергоблоков.<br><br>В 1981 году началось поэтапное сооружение энергоблоков станции. В течение 1984—1987 годов были введены в эксплуатацию четыре энергоблока, в 1988 году был принят проект расширения станции, предусматривающий строительство ещё двух энергоблоков с аналогичными реакторами. В августе 1989 года был запущен энергоблок № 5, а шестой — лишь в 1995 году. Пуск шестого энергоблока планировался в 1990 году и он был практически готов к сдаче. Но из-за объявленного моратория на строительство и ввод новых мощностей АЭС на Украине его не успели пустить в намеченный срок и блок простоял до 1993 года, когда был отменён мораторий. С момента ввода шестого блока Запорожская атомная станция стала крупнейшей атомной станцией в Европе";34.5874388;47.5079886;0
Украина - Одесская АТЭС;"<img src="https://doc-14-04-mymaps.googleusercontent.com/untrusted/hostedimage/67ht0gn364521qiheeia79564g/5ddodmemq3voh8kuc189kb84b8/1595361600000/FTCPzVzQEZ0A9SJ2YuS7DeTeOtpcj_VS/*/6AF2TALqKThJ_iqFqwA-3Z61RcNxXp_Yvd8765X06YC47L6aVUawHBbliSMbxfNKODUJDI9qawdOaLKGs9X8AZEWoJGzRvD7c8Bst-QfpRc0ESmaXcnbv3oAkJA9i8tWLm03nzchsDP1Kj9La4EzFwgFdQeWQAvirVtiulC3EHFKa9-phMuherSAJG5T2e57LiaiP5oHiqcw0r_1PZ601Ds3IFOwW5S3_BaaAYLMz6OqVLXvmBJTetF-9q-Rkyc_53JfT1XnAEXNrvszEFZc1ygbMN-JF38TVEA?session=0&fife" height="200" width="auto" /><br><br>Недостроенная атомная теплоэлектроцентраль, расположенная рядом с городом Теплодар Одесской области Украины возле Барабойского водохранилища в 25 км западнее Одессы. Два планировавшихся энергоблока с реакторами ВВЭР-1000 должны были вырабатывать электроэнергию для одесского региона, а также снабжать теплом Одессу, Ильичёвск (ныне Черноморск) и сам Теплодар. Планируемая электрическая мощность станции 2000 МВт, тепловая — 6000 МВт. <br><br>Город Теплодар начал строиться в 80-х годах как инфраструктура атомной электростанции.<br><br>После аварии на Чернобыльской АЭС руководство Советского Союза приняло решение станцию под Одессой не строить.<br><br>Строительство полностью было остановлено в 1989 году";30.3180600000001;46.46361;0
Украина - Ровенская АЭС;"<img src="https://doc-08-04-mymaps.googleusercontent.com/untrusted/hostedimage/67ht0gn364521qiheeia79564g/iuj33q1bb1u2l21bikshhqpuo4/1595361600000/FTCPzVzQEZ0A9SJ2YuS7DeTeOtpcj_VS/*/6AF2TALr96ptdhoFc0-iqXPF9CnfthN3ntOmPEX14V2B2ROM4RkmT0HCNhj5_CC1domIzX_sYIoZxe5R2vkVj35hDIb3-hCvLJe0nOmtY9H3ThxV-frN4roHURcHTawUUSJQtJf8DKDdkf_pajrX_WMTPorr3FGn8rjFKAYHSgbPTFWr9XXCcAxgLgq6HY7yZiWoc4FudRlXsPMQg9JrIsMso-IlN-mSONTuL5szr-MJQih_u8RrbLx2umVu1-3MOlCzQjOOf5vb4V9QsGsY2kf3noG465y92pQ?session=0&fife" height="200" width="auto" /><br><br>Ровенская АЭС — первая на Украине атомная электростанция с водо-водяными ядерными реакторами, в настоящее время являющимися единственным типом реакторов на Украине, и единственная — с энергоблоками на базе первых реакторов этой серии ВВЭР-440 (В-213).<br><br>Ровенская АЭС (РАЭС) расположена в Волынском Полесье, около реки Стыр в четырёх километрах от города Вараш.<br><br>Отсчёт своей истории станция ведёт с 1971 года, когда началось проектирование Западно-Украинской АЭС, которую во время строительства переименовали в Ровенскую. В документах компании на русском языке станция называется Ривненской. Сокращённое наименование — ОП РАЭС, где ОП означает обособленное подразделение НАЭК «Энергоатом».<br><br>Строительство станции началось в 1973 году. Два первых энергоблока с реакторами ВВЭР-440 введены в эксплуатацию в 1980—1981 годах, а 3-й энергоблок — миллионник — в 1986 году.<br><br>Ровенская АЭС была первой атомной станцией в Советском Союзе, которая прошла проверку МАГАТЭ в начале 1989 года. В состав миссии входили ведущие специалисты Японии, США, Канады, Франции, Германии, Финляндии и других стран мира. Зарубежные эксперты и наблюдатели высоко оценили уровень безопасности станции. Европейский союз избрал Ровенскую станцию базовой для выполнения ряда международных проектов.<br><br>Строительство 4-го энергоблока РАЭС началось в 1984 году, и в 1991 году предполагалось введение его в эксплуатацию. Однако именно тогда работы приостановили вследствие введения моратория Верховной рады на сооружение ядерных объектов на территории Украины.<br><br>Строительство возобновилось в 1993 году после отмены моратория. Было проведено обследование 4-го энергоблока, подготовлена программа его модернизации и досье проекта завершения строительства. Проведены также общественные слушания по этому вопросу. 10 октября 2004 года 4-й энергоблок Ровенской АЭС был введён в эксплуатацию. Реакторные установки 3-го и 4-го энергоблоков Ровенской АЭС относятся к «большой серии» ВВЭР-1000 (В-320).<br><br>10 декабря 2010 года выездная сессия Государственной инспекции ядерного регулирования приняла решение о продлении срока эксплуатации энергоблоков № 1 и 2 на двадцать лет.<br><br>В 2011 году станцией было выработано 17 550 миллионов кВт·ч электроэнергии, что составляет 19,4 % производства на атомных электростанциях Украины.";25.8944349;51.3299701;0
Украина - Чернобыльская АЭС;"<img src="https://doc-0o-04-mymaps.googleusercontent.com/untrusted/hostedimage/67ht0gn364521qiheeia79564g/m6snuepcpihd5sei5da0ves5ic/1595361600000/FTCPzVzQEZ0A9SJ2YuS7DeTeOtpcj_VS/*/6AF2TALptUEijpUCcLgAFx0knr_C39Jo8gJzA69kTPtNJyNNaILGgKSH7B8EiqWfGLFUKe58qa6Ao6pajYDabh05QMvCbHCBYycGs5HghOc8SKFaCUblUJrWyUxicu8kUsELi256480Mr_sJbb6hguCnnLmL4Oqx6CdBFjP6gwPq2NMC-RhYs_2HC7kADoCSJjoBhNPCM26NjNV_-NmIYhM4lH-Ng_saomxdR0hEpJ9oyNX2V9ZyGN6pYMWz04BVznV6ePeGVqf_W32Ams_ZG-oroIfE62cn1CQ?session=0&fife" height="200" width="auto" /><br><br>Остановленная атомная электростанция на Украине, известная в связи с аварией, произошедшей в ночь с 25 на 26 апреля 1986 года в 1:23:47.<br><br>Официальное название Государственное специализированное предприятие Черно?быльская атомная электростанция (ГСП Чернобыльская АЭС)[1]. Станция находится в подчинении министерства экологии.<br><br>В настоящее время принят в эксплуатацию новый саркофаг над аварийным 4-м энергоблоком. Новый саркофаг (называемый "новый безопасный конфайнмент" (НБК) был надвинут в проектное положение в ноябре 2016 года, завершение проекта планируется на 30 ноября 2020 года.";30.09407992023498;51.38923763215244;0
Украина - Чигиринская АЭС;"<img src="https://doc-10-04-mymaps.googleusercontent.com/untrusted/hostedimage/67ht0gn364521qiheeia79564g/lo9t6vs4cb6omrg50ihcemkick/1595361600000/FTCPzVzQEZ0A9SJ2YuS7DeTeOtpcj_VS/*/6AF2TALrPaZ5HPRlMMbF9I1vwRdtfx0epRFeH5LhpjvOeaWBqbjk5r4yEoYnxnQVvKzj6-j8fliiXR3nd3rAXhmy3IYLRNwD2_Bxwkk2dHvxQhMvStsuHAnSzEI8VsNDHzA1Upz_1m5fu_86do7zZj6I3cuVoTDz-YJPbN6lZOqj_X0imAQUm6rMpBCHJ511ETiMc_j4OjRYQ7-cBv8gnkWFaM-tmYvaIHgKlflgTNXLCutb4S9olzfECWvHCdxzChNN5ZqBwVwJSe4YLhAnq2qpuopdJykJRpA?session=0&fife" height="200" width="auto" /><br><br>Недостроенная атомная электростанция, расположенная вблизи посёлка Орбита, в 10 км северо-восточнее Чигирина, в Черкасской области на берегу Днепра. Первоначально станция планировалась как ГРЭС. Решение о строительстве было принято ЦК КПУ 20 августа 1970 года. <br><br>Согласно генеральному плану строительство должно проходить возле села Витово, Чигиринского района, Черкасской области. Первоначальная проектная мощность — 4800 МВт. Новая станция должна была обеспечить потребности химических предприятий города Черкассы.<br><br>Вместе со станцией планировали построить городок энергетиков — Орбита, на 20 тысяч человек. Строительство планировалось завершить в 1976 году. Но из-за изменений проекта, вначале мощность снизили до 3200 МВт, а затем до 1600 МВт. Само же строительство началось только в 1977 году. После ряда неудач, указанием Минэнерго СССР от 29 октября 1981 года, строительство ГРЭС и города было остановлено и законсервировано.";32.79;49.08944;0
Украина - Хмельницкая АЭС;"<img src="https://doc-00-04-mymaps.googleusercontent.com/untrusted/hostedimage/67ht0gn364521qiheeia79564g/4aob76manodoocf482enurskdo/1595361600000/FTCPzVzQEZ0A9SJ2YuS7DeTeOtpcj_VS/*/6AF2TALqKxh8uTXVwwI8p3nhOPAp0A4vR7ov28XrF9q6JJNWBOdJEicwyjocMmd9tdXskuCgS4-e-BYmVLUJ5wkyHVx4NhE9IjyJAo-V7OlHMi6_3Pgv79WgDJ_UaNl7AwcGkf2ASm_Mj79ByRYO8LGNsPPe542a4nIjgWD7TIy2N88sW6IMZfDRyrmUGnaojbp-NBJz7wFMblsHUN7eGgoX4qPImbgA-79hu31JEKeJaWJX3oLA0Qbui9BKYcFqS6R-5mya9KBdztYejlzjRsaQv-tQsTxHdaw?session=0&fife" height="200" width="auto" /><br><br>По проекту АЭС четырёхблочная общей мощностью 4000 МВт с энергоблоками, оснащёнными серийными реакторами ВВЭР-1000. В 1981 году начато строительство. В конце 1987 года введён первый блок, тогда же были подготовлены площадки ещё для трёх блоков. Второй энергоблок начали строить в 1983 году, пуск планировался в конце 1991 года[2].<br><br>В 1990 году Верховная Рада Украины объявила мораторий на строительство новых АЭС, во время действия которого на Хмельницкой станции были смонтированы основные технологические узлы и подготовлен персонал для работы на втором блоке.<br><br>Сооружение Хмельницкого-2 возобновили в 1993 году, однако из-за недостаточного финансирования строительные работы шли медленно, с середины 2002 года они были значительно ускорены.<br><br>25 июля 1996 года произошёл аварийный выброс радиоактивного пара в помещения станции[3]. Минимум один работник станции погиб[4]. Выброс в окружающую среду зафиксирован не был.<br><br>В июле 2004 года состоялся физический, а 8 августа — энергетический пуск 2-го энергоблока ХАЭС.<br><br>7 сентября 2005 года Государственная приёмная комиссия подписала акт о введении второго блока ХАЭС в промышленную эксплуатацию.<br><br>30 апреля 2010 года на встрече премьер-министров России и Украины было принято решение о сотрудничестве «Росатома» и Минтопэнерго Украины в постройке третьего и четвёртого энергоблоков ХАЭС[5], предполагалось, что строительство будет вести ЗАО «Атомстройэкспорт».<br><br>16 сентября 2015 года президент Украины Пётр Порошенко подписал законы о прекращении сотрудничества с Россией в строительстве энергоблоков Хмельницкой АЭС<br><br>17.10.2019 остановлен 2-ой блок АЭС. <br>Первый блок был остановлен в 2018 году.";26.6502594;50.3024554;0
